{"$schema":"http://json-schema.org/draft-07/schema#","$id":"casey/entity-locks-frozen.successor.json","type":"object","additionalProperties":false,"required":["schemaVersion","artifactKind","caseId","signed","replayReady","signerId","signedAt","audience","eventsSha256","bindings","signature"],"properties":{"schemaVersion":{"const":1},"artifactKind":{"const":"entity-locks-frozen"},"caseId":{"type":"string"},"signed":{"const":true},"replayReady":{"const":true},"signerId":{"type":"string"},"signedAt":{"type":"string"},"audience":{"enum":["test","production"]},"eventsSha256":{"type":"string","pattern":"^sha256:[a-f0-9]{64}$"},"bindings":{"type":"array","minItems":1,"items":{"$ref":"#/definitions/binding"}},"signature":{"type":"string","pattern":"^sha256:[a-f0-9]{64}$"}},"definitions":{"binding":{"type":"object","additionalProperties":false,"required":["stepId","intentId","atom","role","candidateId","lockId","receiptHash"],"properties":{"stepId":{"type":"string"},"intentId":{"type":"string"},"atom":{"type":"string"},"role":{"enum":["subject","source","target"]},"candidateId":{"type":"string"},"lockId":{"type":"string"},"receiptHash":{"type":"string","pattern":"^sha256:[a-f0-9]{64}$"}}}}}
