{
  "schemaVersion": 1,
  "artifactKind": "entity-locks-frozen",
  "caseId": "tc-admission-authority",
  "signed": true,
  "replayReady": true,
  "signerId": "fixture-human",
  "signedAt": "2026-07-17T00:00:00.000Z",
  "audience": "test",
  "eventsSha256": "sha256:38beca47bfa24918eaec5acda66c82828744164687c37f7aee5b0e49bcf3ed6d",
  "bindings": [
    {
      "stepId": "atstep_1",
      "intentId": "intent_1",
      "atom": "workflow.rename",
      "role": "target",
      "candidateId": "candidate-workflow-main",
      "lockId": "lock-workflow-main",
      "receiptHash": "sha256:dddddddddddddddddddddddddddddddddddddddddddddddddddddddddddddddd"
    },
    {
      "stepId": "atstep_1",
      "intentId": "intent_1",
      "atom": "workflow.rename",
      "role": "target",
      "candidateId": "candidate-workflow-main",
      "lockId": "lock-workflow-main",
      "receiptHash": "sha256:dddddddddddddddddddddddddddddddddddddddddddddddddddddddddddddddd"
    }
  ],
  "signature": "sha256:8737938cb8e769edfeb66a2262cd54bf6f5564f925a58b6fa793329d04e30acc"
}
